<?xml version="1.0" encoding="UTF-8"?>
<touristVouchers xmlns:xsi="http://www.w3.org/2001/XMLSchema-instance"
                 xsi:noNamespaceSchemaLocation="touristVouchers.xsd">
    <touristVoucher id="czech1">
        <type>WEEKEND</type>
        <country>Czech Republic</country>
        <startDate>2020-02-25</startDate>
        <numberDaysNights>3</numberDaysNights>
        <transport>BUS</transport>
        <hotelSpecification>
            <stars>3</stars>
            <meals>HB</meals>
            <numberOfRooms>1</numberOfRooms>
            <airCondition>true</airCondition>
            <tv>true</tv>
            <wifi>true</wifi>
            <parking>false</parking>
        </hotelSpecification>
        <price>300.00</price>
    </touristVoucher>
    <touristVoucher id="usa1">
        <type>RELAXATION</type>
        <country>USA</country>
        <startDate>2020-05-09</startDate>
        <numberDaysNights>30</numberDaysNights>
        <transport>AIR</transport>
        <hotelSpecification>
            <stars>4</stars>
            <meals>AI</meals>
            <numberOfRooms>2</numberOfRooms>
            <airCondition>true</airCondition>
            <tv>true</tv>
            <wifi>true</wifi>
            <parking>false</parking>
        </hotelSpecification>
        <price>6000.00</price>
    </touristVoucher>
    <touristVoucher id="isr1">
        <type>PILGRIMAGE</type>
        <country>Israel</country>
        <startDate>2020-03-01</startDate>
        <numberDaysNights>14</numberDaysNights>
        <transport>BUS</transport>
        <hotelSpecification>
            <stars>2</stars>
            <meals>HB</meals>
            <numberOfRooms>1</numberOfRooms>
            <airCondition>false</airCondition>
            <tv>false</tv>
            <wifi>false</wifi>
            <parking>false</parking>
        </hotelSpecification>
        <price>2000.00</price>
    </touristVoucher>
    <touristVoucher id="SA4">
        <type>PILGRIMAGE</type>
        <country>India</country>
        <startDate>2020-08-09</startDate>
        <numberDaysNights>21</numberDaysNights>
        <transport>AIR</transport>
        <hotelSpecification>
            <stars>5</stars>
            <meals>AI</meals>
            <numberOfRooms>3</numberOfRooms>
            <airCondition>true</airCondition>
            <tv>true</tv>
            <wifi>true</wifi>
            <parking>true</parking>
        </hotelSpecification>
        <price>3250.00</price>
    </touristVoucher>
</touristVouchers>


